{
  "artifact_type": "shot-camera-spec",
  "scene_id": "SC-WORKSHOP-01",
  "state_snapshot_sha256_by_character": {
    "C01": "fa8bb2abf9db91cca8f807277795c82b0d3c0c609f2af30b53b04736009ef398",
    "C02": "4e367aba0f6784aba6d7d22b298abd58cf55841047208655759e8df7409d9e58"
  },
  "shot_id": "SC-WORKSHOP-01-SH05",
  "order_index": 5,
  "viewpoint_profile_id": "external-character-aligned-third-person",
  "profile_family": "external",
  "camera_ownership": "external_camera",
  "camera_owner_character_id": null,
  "knowledge_scope": "character_restricted",
  "focal_character_ids": [
    "C01"
  ],
  "point_of_audition": "objective_mix",
  "audition_character_id": null,
  "coverage_role": "external reaction close-up",
  "camera_position": "workbench side, three-quarter on C01 face and right hand",
  "shot_scale": "close-up",
  "camera_height": "C01 face height",
  "angle": "slight right three-quarter",
  "lens_behavior": "gentle portrait compression with P01 low in frame",
  "movement": {
    "type": "locked",
    "cause": "show C01 controlled reaction after seeing the damage",
    "start_relation": "camera begins on C01 eyes and P01 in the lower frame",
    "path": "hold through one breath and a small ear response",
    "speed_and_amplitude": "no travel",
    "subject_relation": "C01 face dominates while C02 remains soft in background",
    "occlusion_risk": "P01 must remain visible below the muzzle",
    "landing_composition": "C01 eyes lift from P01 to C02 while the right hand keeps the pendant"
  },
  "screen_direction": "C01 faces screen-right toward C02",
  "axis_side": "same doorway side of the axis",
  "eyeline_relation": "C01 gaze moves from P01 to C02",
  "visible_subjects": [
    "C01",
    "C02"
  ],
  "visible_body_regions": {
    "C01": [
      "face",
      "ears",
      "right hand",
      "upper torso"
    ],
    "C02": [
      "soft background face"
    ]
  },
  "prop_ownership": {
    "P01": "C01 right hand"
  },
  "start_anchor": "C01 looks down at P01 in the right hand",
  "end_anchor": "C01 looks up at C02 with guarded concern",
  "knowledge_visibility": [
    "The audience reads concern and guarded posture without seeing the injury."
  ],
  "accepted_variation": [
    "small eye timing"
  ],
  "review_dimensions": [
    "face identity",
    "left ear clip",
    "P01 ownership",
    "masked emotion"
  ],
  "camera_spec_sha256": "c5788a955772faa75941f2cf5891f9455dafe0be4d3df1abeb96e1fee2fc4e67"
}
