{
  "artifact_type": "shot-camera-spec",
  "scene_id": "SC-WORKSHOP-01",
  "state_snapshot_sha256_by_character": {
    "C01": "fa8bb2abf9db91cca8f807277795c82b0d3c0c609f2af30b53b04736009ef398",
    "C02": "4e367aba0f6784aba6d7d22b298abd58cf55841047208655759e8df7409d9e58"
  },
  "shot_id": "SC-WORKSHOP-01-SH04",
  "order_index": 4,
  "viewpoint_profile_id": "embodied-first-person",
  "profile_family": "embodied-first-person",
  "camera_ownership": "character_body",
  "camera_owner_character_id": "C01",
  "knowledge_scope": "character_restricted",
  "focal_character_ids": [
    "C01"
  ],
  "point_of_audition": "character_subjective",
  "audition_character_id": "C01",
  "coverage_role": "subjective handoff insert",
  "camera_position": "C01 eye position facing across the workbench",
  "shot_scale": "first-person hand and object close view",
  "camera_height": "C01 eye height",
  "angle": "slight look down toward the handoff",
  "lens_behavior": "natural embodied perspective with C01 right hand entering from lower-right",
  "movement": {
    "type": "held",
    "cause": "C01 follows P01 down into the receiving hand",
    "start_relation": "view begins on C02 face and P01 at eye level",
    "path": "gaze lowers with the object as C02 places it into C01 right palm",
    "speed_and_amplitude": "small controlled downward gaze",
    "subject_relation": "C02 stays beyond the object and releases after C01 fingers close",
    "occlusion_risk": "hands may briefly occlude the pendant rim but ownership must remain readable",
    "landing_composition": "P01 rests in C01 right palm with C02 hand withdrawing"
  },
  "screen_direction": "C02 remains centered beyond the handoff",
  "axis_side": "camera owner remains on C01 side of the axis",
  "eyeline_relation": "gaze follows P01 from C02 face to C01 hand",
  "visible_subjects": [
    "C01",
    "C02"
  ],
  "visible_body_regions": {
    "C01": [
      "right hand",
      "right wrist"
    ],
    "C02": [
      "face",
      "right hand",
      "upper torso"
    ]
  },
  "prop_ownership": {
    "P01": "C01 right hand after visible transfer"
  },
  "start_anchor": "P01 in C02 right fingers at eye level",
  "end_anchor": "P01 in C01 right palm while C02 hand releases",
  "knowledge_visibility": [
    "C01 directly inspects the crack; concealed injury remains offscreen."
  ],
  "accepted_variation": [
    "minor finger spacing"
  ],
  "review_dimensions": [
    "camera-owner hand ownership",
    "transfer order",
    "P01 orientation",
    "subjective audition"
  ],
  "camera_spec_sha256": "381126dbd0a9d801afac68208f97dd6e43ae97a33a85227eac363ad62f8aba45"
}
