{
  "artifact_type": "shot-camera-spec",
  "scene_id": "SC-WORKSHOP-01",
  "state_snapshot_sha256_by_character": {
    "C01": "fa8bb2abf9db91cca8f807277795c82b0d3c0c609f2af30b53b04736009ef398",
    "C02": "4e367aba0f6784aba6d7d22b298abd58cf55841047208655759e8df7409d9e58"
  },
  "shot_id": "SC-WORKSHOP-01-SH06",
  "order_index": 6,
  "viewpoint_profile_id": "external-character-aligned-third-person",
  "profile_family": "external",
  "camera_ownership": "external_camera",
  "camera_owner_character_id": null,
  "knowledge_scope": "shared_restricted",
  "focal_character_ids": [
    "C01",
    "C02"
  ],
  "point_of_audition": "objective_mix",
  "audition_character_id": null,
  "coverage_role": "external landing master",
  "camera_position": "slightly wider on the same doorway side, centered on both characters and the workbench",
  "shot_scale": "medium wide two-shot",
  "camera_height": "chest height",
  "angle": "level three-quarter",
  "lens_behavior": "stable moderate lens matching the opening geography",
  "movement": {
    "type": "dolly",
    "cause": "restore shared geography and create a continuation-ready landing",
    "start_relation": "camera begins close on C01 reaction side",
    "path": "dolly back a short distance along the same axis side",
    "speed_and_amplitude": "slow one-meter retreat",
    "subject_relation": "keep both characters on their established screen sides",
    "occlusion_risk": "workbench edge remains below both hands",
    "landing_composition": "C01 holds P01 at the near workbench edge while C02 waits across from them"
  },
  "screen_direction": "C01 remains screen-left facing right; C02 remains screen-right facing left",
  "axis_side": "doorway side of the axis",
  "eyeline_relation": "both characters look toward each other across P01",
  "visible_subjects": [
    "C01",
    "C02"
  ],
  "visible_body_regions": {
    "C01": [
      "head",
      "torso",
      "arms",
      "hands"
    ],
    "C02": [
      "head",
      "torso",
      "arms",
      "hands"
    ]
  },
  "prop_ownership": {
    "P01": "C01 right hand"
  },
  "start_anchor": "C01 reaction close-up with P01 in hand",
  "end_anchor": "both characters settle across the workbench with P01 visibly in C01 right hand",
  "knowledge_visibility": [
    "Both characters and the audience know the pendant damage; injury remains concealed."
  ],
  "accepted_variation": [
    "minor stance width"
  ],
  "review_dimensions": [
    "re-established geography",
    "prop ownership",
    "state continuity",
    "continuation endpoint"
  ],
  "camera_spec_sha256": "1afcadd52c88ffe259934d4e3dbe04fb4f13fa32c46e51466df363e316b110aa"
}
